{"schema_version":"1.0.0","campaign_id":"qualification","scope_hash":"aaaaaaaaaaaaaaaaaaaaaaaaaaaaaaaaaaaaaaaaaaaaaaaaaaaaaaaaaaaaaaaa","obligations":[{"obligation_id":"o1","rule_id":"F03","contract_revision":"v1","required_variant":"v3","evidence_requirement":"event","automated":true,"applicability":"applicable","attempted":true,"asserted":true,"confirmed":true,"gap_reasons":[],"blocked_by":[]}],"native_counts":{"passed":1,"failed":0,"broken":0,"skipped":0,"unknown":0}}
